[
  {
    "id": "control_common_torus",
    "name": "Control Ring",
    "description": "A ring-shaped visual for control particles.",
    "role": "CONTROL",
    "tier": "COMMON",
    "particleAppearance": {
      "shape": "TORUS",
      "color": "#9370DB",
      "size": 1.0,
      "opacity": 0.8,
      "emissive": false,
      "roughness": 0.4,
      "metalness": 0.3
    },
    "animation": {
      "type": "SPIN",
      "speed": 0.9,
      "variation": 0.1,
      "parameters": {
        "axis": {
          "x": 1.0,
          "y": 0.0,
          "z": 0.0
        }
      }
    },
    "effects": []
  },
  {
    "id": "control_common_sphere",
    "name": "Control Orb",
    "description": "A spherical visual for control particles.",
    "role": "CONTROL",
    "tier": "COMMON",
    "particleAppearance": {
      "shape": "SPHERE",
      "color": "#9370DB",
      "size": 0.9,
      "opacity": 0.7,
      "emissive": true,
      "emissiveColor": "#B19CD9",
      "emissiveIntensity": 0.2,
      "roughness": 0.3,
      "metalness": 0.2
    },
    "animation": {
      "type": "ORBIT",
      "speed": 0.8,
      "variation": 0.2,
      "parameters": {
        "center": {
          "x": 0.0,
          "y": 0.0,
          "z": 0.0
        },
        "radius": 0.2
      }
    },
    "effects": []
  },
  {
    "id": "control_common_octahedron",
    "name": "Control Crystal",
    "description": "A crystalline visual for control particles.",
    "role": "CONTROL",
    "tier": "COMMON",
    "particleAppearance": {
      "shape": "CUSTOM",
      "color": "#9370DB",
      "size": 0.8,
      "opacity": 0.9,
      "emissive": false,
      "roughness": 0.5,
      "metalness": 0.4
    },
    "animation": {
      "type": "PULSE",
      "speed": 1.0,
      "variation": 0.1,
      "parameters": {
        "minSize": 0.7,
        "maxSize": 0.9,
        "frequency": 1.0
      }
    },
    "effects": []
  },
  {
    "id": "control_common_web",
    "name": "Control Web",
    "description": "A web-like visual for control particles.",
    "role": "CONTROL",
    "tier": "COMMON",
    "particleAppearance": {
      "shape": "CUSTOM",
      "color": "#9370DB",
      "size": 1.1,
      "opacity": 0.6,
      "emissive": true,
      "emissiveColor": "#B19CD9",
      "emissiveIntensity": 0.3,
      "roughness": 0.2,
      "metalness": 0.1,
      "wireframe": true
    },
    "animation": {
      "type": "SPIN",
      "speed": 0.5,
      "variation": 0.1,
      "parameters": {
        "axis": {
          "x": 0.0,
          "y": 1.0,
          "z": 0.0
        }
      }
    },
    "effects": [
      {
        "type": "AURA",
        "trigger": "ALWAYS",
        "intensity": 0.2,
        "duration": 0,
        "parameters": {
          "radius": 1.5
        }
      }
    ]
  }
]
