[
  {
    "id": "attack_common_cone",
    "name": "Attack Spike",
    "description": "A sharp, cone-shaped visual for attack particles.",
    "role": "ATTACK",
    "tier": "COMMON",
    "particleAppearance": {
      "shape": "CONE",
      "color": "#FF4500",
      "size": 1.0,
      "opacity": 0.9,
      "emissive": false,
      "roughness": 0.3,
      "metalness": 0.5
    },
    "animation": {
      "type": "SPIN",
      "speed": 1.2,
      "variation": 0.1,
      "parameters": {
        "axis": {
          "x": 0.0,
          "y": 0.0,
          "z": 1.0
        }
      }
    },
    "effects": []
  },
  {
    "id": "attack_common_tetrahedron",
    "name": "Attack Blade",
    "description": "A blade-like visual for attack particles.",
    "role": "ATTACK",
    "tier": "COMMON",
    "particleAppearance": {
      "shape": "CUSTOM",
      "color": "#FF4500",
      "size": 0.9,
      "opacity": 0.9,
      "emissive": false,
      "roughness": 0.2,
      "metalness": 0.7
    },
    "animation": {
      "type": "SPIN",
      "speed": 1.0,
      "variation": 0.2,
      "parameters": {
        "axis": {
          "x": 0.0,
          "y": 1.0,
          "z": 0.0
        }
      }
    },
    "effects": []
  },
  {
    "id": "attack_common_sphere",
    "name": "Attack Orb",
    "description": "A fiery orb visual for attack particles.",
    "role": "ATTACK",
    "tier": "COMMON",
    "particleAppearance": {
      "shape": "SPHERE",
      "color": "#FF4500",
      "size": 0.8,
      "opacity": 0.9,
      "emissive": true,
      "emissiveColor": "#FF8C00",
      "emissiveIntensity": 0.3,
      "roughness": 0.7,
      "metalness": 0.0
    },
    "animation": {
      "type": "PULSE",
      "speed": 1.5,
      "variation": 0.2,
      "parameters": {
        "minSize": 0.7,
        "maxSize": 0.9,
        "frequency": 1.2
      }
    },
    "effects": [
      {
        "type": "FIRE",
        "trigger": "ALWAYS",
        "intensity": 0.3,
        "duration": 0,
        "parameters": {
          "particleCount": 5,
          "radius": 0.2
        }
      }
    ]
  },
  {
    "id": "attack_common_arrow",
    "name": "Attack Arrow",
    "description": "An arrow-shaped visual for attack particles.",
    "role": "ATTACK",
    "tier": "COMMON",
    "particleAppearance": {
      "shape": "CUSTOM",
      "color": "#FF4500",
      "size": 1.1,
      "opacity": 0.9,
      "emissive": false,
      "roughness": 0.4,
      "metalness": 0.4
    },
    "animation": {
      "type": "STATIC",
      "speed": 0.0,
      "variation": 0.0,
      "parameters": {}
    },
    "effects": []
  }
]
