[
  {
    "id": "movement_common_cone",
    "name": "Movement Dart",
    "description": "A dart-shaped visual for movement particles.",
    "role": "MOVEMENT",
    "tier": "COMMON",
    "particleAppearance": {
      "shape": "CONE",
      "color": "#00FF00",
      "size": 1.0,
      "opacity": 0.8,
      "emissive": false,
      "roughness": 0.4,
      "metalness": 0.3
    },
    "animation": {
      "type": "STATIC",
      "speed": 0.0,
      "variation": 0.0,
      "parameters": {}
    },
    "effects": [
      {
        "type": "TRAIL",
        "trigger": "MOVING",
        "intensity": 0.3,
        "duration": 0.3,
        "parameters": {
          "length": 5,
          "fadeRate": 0.1
        }
      }
    ]
  },
  {
    "id": "movement_common_sphere",
    "name": "Movement Orb",
    "description": "A spherical visual for movement particles.",
    "role": "MOVEMENT",
    "tier": "COMMON",
    "particleAppearance": {
      "shape": "SPHERE",
      "color": "#00FF00",
      "size": 0.8,
      "opacity": 0.7,
      "emissive": false,
      "roughness": 0.3,
      "metalness": 0.2
    },
    "animation": {
      "type": "WAVE",
      "speed": 1.2,
      "variation": 0.2,
      "parameters": {
        "amplitude": 0.2,
        "frequency": 1.5,
        "direction": {
          "x": 1.0,
          "y": 0.0,
          "z": 0.0
        }
      }
    },
    "effects": []
  },
  {
    "id": "movement_common_cylinder",
    "name": "Movement Cylinder",
    "description": "A cylindrical visual for movement particles.",
    "role": "MOVEMENT",
    "tier": "COMMON",
    "particleAppearance": {
      "shape": "CYLINDER",
      "color": "#00FF00",
      "size": 0.9,
      "opacity": 0.8,
      "emissive": false,
      "roughness": 0.5,
      "metalness": 0.2
    },
    "animation": {
      "type": "SPIN",
      "speed": 1.5,
      "variation": 0.1,
      "parameters": {
        "axis": {
          "x": 1.0,
          "y": 0.0,
          "z": 0.0
        }
      }
    },
    "effects": []
  },
  {
    "id": "movement_common_arrow",
    "name": "Movement Arrow",
    "description": "An arrow-shaped visual for movement particles.",
    "role": "MOVEMENT",
    "tier": "COMMON",
    "particleAppearance": {
      "shape": "CUSTOM",
      "color": "#00FF00",
      "size": 1.1,
      "opacity": 0.9,
      "emissive": false,
      "roughness": 0.4,
      "metalness": 0.3
    },
    "animation": {
      "type": "STATIC",
      "speed": 0.0,
      "variation": 0.0,
      "parameters": {}
    },
    "effects": [
      {
        "type": "TRAIL",
        "trigger": "MOVING",
        "intensity": 0.4,
        "duration": 0.4,
        "parameters": {
          "length": 7,
          "fadeRate": 0.1
        }
      }
    ]
  }
]
