[
  {
    "id": "core_common_sphere",
    "name": "Core Sphere",
    "description": "A basic spherical visual for core particles.",
    "role": "CORE",
    "tier": "COMMON",
    "particleAppearance": {
      "shape": "SPHERE",
      "color": "#00FFFF",
      "size": 1.0,
      "opacity": 0.8,
      "emissive": false,
      "roughness": 0.5,
      "metalness": 0.2
    },
    "animation": {
      "type": "PULSE",
      "speed": 1.0,
      "variation": 0.1,
      "parameters": {
        "minSize": 0.8,
        "maxSize": 1.2,
        "frequency": 1.0
      }
    },
    "effects": []
  },
  {
    "id": "core_common_cube",
    "name": "Core Cube",
    "description": "A basic cubic visual for core particles.",
    "role": "CORE",
    "tier": "COMMON",
    "particleAppearance": {
      "shape": "CUBE",
      "color": "#00FFFF",
      "size": 0.9,
      "opacity": 0.8,
      "emissive": false,
      "roughness": 0.5,
      "metalness": 0.2
    },
    "animation": {
      "type": "SPIN",
      "speed": 0.8,
      "variation": 0.1,
      "parameters": {
        "axis": {
          "x": 0.1,
          "y": 1.0,
          "z": 0.1
        }
      }
    },
    "effects": []
  },
  {
    "id": "core_common_torus",
    "name": "Core Ring",
    "description": "A ring-shaped visual for core particles.",
    "role": "CORE",
    "tier": "COMMON",
    "particleAppearance": {
      "shape": "TORUS",
      "color": "#00FFFF",
      "size": 1.1,
      "opacity": 0.8,
      "emissive": false,
      "roughness": 0.5,
      "metalness": 0.2
    },
    "animation": {
      "type": "SPIN",
      "speed": 0.6,
      "variation": 0.1,
      "parameters": {
        "axis": {
          "x": 1.0,
          "y": 0.5,
          "z": 0.2
        }
      }
    },
    "effects": []
  },
  {
    "id": "core_common_icosahedron",
    "name": "Core Crystal",
    "description": "A crystalline visual for core particles.",
    "role": "CORE",
    "tier": "COMMON",
    "particleAppearance": {
      "shape": "ICOSAHEDRON",
      "color": "#00FFFF",
      "size": 0.9,
      "opacity": 0.8,
      "emissive": false,
      "roughness": 0.3,
      "metalness": 0.4
    },
    "animation": {
      "type": "STATIC",
      "speed": 0.0,
      "variation": 0.0,
      "parameters": {}
    },
    "effects": []
  }
]
