[
  {
    "id": "defense_common_cube",
    "name": "Defense Block",
    "description": "A solid, cube-shaped visual for defense particles.",
    "role": "DEFENSE",
    "tier": "COMMON",
    "particleAppearance": {
      "shape": "CUBE",
      "color": "#2E8B57",
      "size": 1.0,
      "opacity": 1.0,
      "emissive": false,
      "roughness": 0.7,
      "metalness": 0.3
    },
    "animation": {
      "type": "STATIC",
      "speed": 0.0,
      "variation": 0.0,
      "parameters": {}
    },
    "effects": []
  },
  {
    "id": "defense_common_sphere",
    "name": "Defense Orb",
    "description": "A spherical shield visual for defense particles.",
    "role": "DEFENSE",
    "tier": "COMMON",
    "particleAppearance": {
      "shape": "SPHERE",
      "color": "#2E8B57",
      "size": 1.1,
      "opacity": 0.8,
      "emissive": false,
      "roughness": 0.2,
      "metalness": 0.5
    },
    "animation": {
      "type": "PULSE",
      "speed": 0.7,
      "variation": 0.1,
      "parameters": {
        "minSize": 1.0,
        "maxSize": 1.2,
        "frequency": 0.8
      }
    },
    "effects": []
  },
  {
    "id": "defense_common_icosahedron",
    "name": "Defense Crystal",
    "description": "A crystalline visual for defense particles.",
    "role": "DEFENSE",
    "tier": "COMMON",
    "particleAppearance": {
      "shape": "ICOSAHEDRON",
      "color": "#2E8B57",
      "size": 0.9,
      "opacity": 1.0,
      "emissive": false,
      "roughness": 0.5,
      "metalness": 0.5
    },
    "animation": {
      "type": "SPIN",
      "speed": 0.5,
      "variation": 0.1,
      "parameters": {
        "axis": {
          "x": 0.0,
          "y": 1.0,
          "z": 0.0
        }
      }
    },
    "effects": []
  },
  {
    "id": "defense_common_shield",
    "name": "Defense Shield",
    "description": "A shield-shaped visual for defense particles.",
    "role": "DEFENSE",
    "tier": "COMMON",
    "particleAppearance": {
      "shape": "CUSTOM",
      "color": "#2E8B57",
      "size": 1.2,
      "opacity": 0.9,
      "emissive": false,
      "roughness": 0.6,
      "metalness": 0.4
    },
    "animation": {
      "type": "STATIC",
      "speed": 0.0,
      "variation": 0.0,
      "parameters": {}
    },
    "effects": [
      {
        "type": "SHIELD",
        "trigger": "DAMAGED",
        "intensity": 0.3,
        "duration": 0.5,
        "parameters": {
          "radius": 1.3
        }
      }
    ]
  }
]
